{
  "$schema": "https://json-schema.org/draft/2020-12/schema",
  "$id": "https://deckofsweat.local/schemas/workout_template.schema.json",
  "title": "Deck of Sweat Workout Template",
  "type": "object",
  "additionalProperties": true,
  "required": ["template_id", "template_name", "description", "tier", "deck_id", "protocol_type", "duration_minutes", "rounds", "work_seconds", "rest_seconds", "target_intensity", "equipment_required", "movement_focus", "scoring_method", "tracking_enabled", "coaching_notes", "safety_notes"],
  "properties": {
    "template_id": {"type": "string", "pattern": "^[a-z][a-z0-9_]*$"},
    "template_name": {"type": "string", "minLength": 1},
    "description": {"type": "string", "minLength": 1},
    "tier": {"type": "string", "enum": ["free", "plus", "pro"]},
    "deck_id": {"type": "string", "pattern": "^[a-z][a-z0-9_]*$"},
    "protocol_type": {"type": "string", "enum": ["amrap", "emom", "circuit", "ladder", "mobility_flow", "tabata", "chipper", "density"]},
    "duration_minutes": {"type": "integer", "minimum": 1},
    "rounds": {"type": "integer", "minimum": 1},
    "work_seconds": {"type": "integer", "minimum": 0},
    "rest_seconds": {"type": "integer", "minimum": 0},
    "target_intensity": {"type": "string", "minLength": 1},
    "equipment_required": {"type": "array", "items": {"type": "string", "minLength": 1}, "minItems": 1},
    "movement_focus": {"type": "array", "items": {"type": "string", "minLength": 1}, "minItems": 1},
    "scoring_method": {"type": "string", "minLength": 1},
    "tracking_enabled": {"type": "boolean"},
    "coaching_notes": {"type": "array", "items": {"type": "string", "minLength": 1}},
    "safety_notes": {"type": "array", "items": {"type": "string", "minLength": 1}}
  }
}
